"User authenticated.","Tus credenciales son válidas."
"User not authenticated.","Tus credenciales no son válidas."
"Credentials section is incomplete. Please, complete the section and try again.","Configura tus credenciales para poder validarlas."
"Check if your credentials are correct for validate the callback url.","Verifica tus credenciales para validar la URL callback"
"The URL registered is different than declared in the module.","La URL registrada es diferente a la declarada en el modulo"
"Callback Registered.","Callback registrado."
"the first payment will be made at the time of purchase","El primer pago se realizará en el momento de la compra"
"in 5 biweekly installments of","en 5 cuotas quincenales de"
"Inventory error. Product stock could not decrease. Message > ","Error de inventario. No se pudo disminuir la cantidad de un producto. Mensaje > "
